{"desired_plan":{"hard_dependencies":[{"from":{"plan_key":"bridge-persistence-recovery","project_id":"lattice","task_id":"bpr1-selfheal"},"to":{"plan_key":"bridge-persistence-recovery","project_id":"lattice","task_id":"bpr4-release"}},{"from":{"plan_key":"bridge-persistence-recovery","project_id":"lattice","task_id":"bpr2-doc-split"},"to":{"plan_key":"bridge-persistence-recovery","project_id":"lattice","task_id":"bpr4-release"}},{"from":{"plan_key":"bridge-persistence-recovery","project_id":"lattice","task_id":"bpr3-adr"},"to":{"plan_key":"bridge-persistence-recovery","project_id":"lattice","task_id":"bpr4-release"}}],"joins":[],"plan_digest":"d47687e4155b1928131c51698722c112f897a450039c08e6bdfbfcfd2f98e4b1","plan_key":"bridge-persistence-recovery","plan_version":"rev-91e53aa5c3abca2ff79c789b","predecessor_plan_digest":"f4fcdab92987bdbda16f840330ef378ddd48a9c6a33be29b199d2156a135eb5c","project_id":"lattice","schema":"lattice.todo_plan.v6","tasks":[{"compile_binding":null,"design_memo":"## 何を直すか\n\n`snapshotBridgeStartupFolder`（Windows）と`snapshotBridgeLaunchAgent`（macOS）は、常駐設定の\n片割れだけが在る状態でthrowする。この2つはsetup／reconfigure／disableが**必ず通る一点**なので、\nthrowすると「その状態を直す唯一の正規経路」が、直すべき状態そのものに拒否されて詰む。\n\n2026-08-11に実被弾: FOXでStartupのlauncherだけが残りdescriptorが消えていて、\n`lattice bridge reconfigure`が`BRIDGE_STARTUP_FOLDER_STATE_INVALID`で停止。人が手でfileを\n消すまで復旧できなかった。**手作業なしで直せないのが欠陥である。**\n\n## 設計\n\n1. snapshotはthrowせず、分裂を`split: true`として事実のまま返す。\n2. installは両fileの唯一の書き手なので、上書きで畳む（既存の書込順序は変えない）。\n3. restoreは分裂を忠実に戻すだけで起動しない。rollbackは操作前へ戻すことであり、\n   操作前に無かった健全さを発明しない。\n4. 報告は読み手（`bridge-cli.mjs`の`bridgePersistence`）が行い、`state: 'unreadable'`＋\n   `error: 'BRIDGE_PERSISTENCE_STATE_SPLIT'`とする。`remedy`は既にunreadableへreconfigureを\n   出すので、そのまま復旧導線になる。\n\n## 非目標\n\n- 分裂が「なぜ起きたか」の追跡機能。原因は製品外の手作業と特定済み（runtime dirの作成時刻が\n  launcherより新しく、正規installを通っていない）。原因追跡ではなく自己修復で閉じる。\n- `strictFile`／`strictPlist`の安全検査の緩和。symlink・所有者・mode検査は一切触らない。","lane":"implementation","narrative_anchor":null,"narrative_ref":"docs/archive/plan_bridge-persistence-recovery_tasks.md#L6","parent_task_id":null,"task_id":"bpr1-selfheal","title":"常駐設定の分裂状態を製品が自力で畳めるようにする"},{"compile_binding":null,"design_memo":"## 何を書くか\n\n`lattice bridge status`の`persistence.error`に`BRIDGE_PERSISTENCE_STATE_SPLIT`が出た時の\n意味と打つ手を、既存の`persistence`表の直後へ1段落＋表1行で足す。\n\n- 意味: 常駐設定の片割れ（launcherまたはplist）だけが在る。\n- 打つ手: `lattice bridge reconfigure --json`。**手でfileを消す必要は無い**（0.57.2以降）。\n\n## 非目標\n\n既存の表の構成・文言を作り替えない。追記だけ。","lane":"docs","narrative_anchor":null,"narrative_ref":"docs/archive/plan_bridge-persistence-recovery_tasks.md#L7","parent_task_id":null,"task_id":"bpr2-doc-split","title":"docs/bridge-setup.mdへ新しいpersistence状態の読み方を追記する"},{"compile_binding":null,"design_memo":"## 不変Decisionとして固定すること\n\n復旧commandは、復旧対象の異常状態を理由に自分自身を拒否してはならない。異常の検出は\n読み手（status・diagnostic）が行い、書き手（setup／reconfigure／install）は上書きで畳む。\n\n根拠: 2026-08-11、Windows常駐の分裂状態で`reconfigure`が自分の入口で止まり、人が手で\nfileを消すまで復旧不能になった。同型のthrowがmacOS側にも存在した（loaded but no plist）。\n\n統括直轄（F）。ADRは不変Decisionなので委譲しない。","lane":"decision","narrative_anchor":null,"narrative_ref":"docs/archive/plan_bridge-persistence-recovery_tasks.md#L8","parent_task_id":null,"task_id":"bpr3-adr","title":"ADR 0166「復旧経路は復旧対象の状態に拒否されてはならない」を起草する"},{"compile_binding":null,"design_memo":"## 手順\n\nCHANGELOG追記 → version bump → commit → push → `npm publish` → Mac/WSL2で\n`npm install -g @quolu/lattice@0.57.2` → bridge再起動 → 公開面の`/projects/<id>/`が200。\n\n未releaseのstderr重複抑止修正（6d16842）もこの版に載る。\n\n## 罠\n\n`prepublishOnly`はworking treeのcleanと既定ブランチ祖先を要求する。publishはH。","lane":"release","narrative_anchor":null,"narrative_ref":"docs/archive/plan_bridge-persistence-recovery_tasks.md#L9","parent_task_id":null,"task_id":"bpr4-release","title":"0.57.2をreleaseしMac／WSL2へ配って実測する"},{"compile_binding":null,"design_memo":"## 事実\n\nkitepon.dev（root-site-promotion）は公開一覧から消えた。ADR 0165の意味論どおり\n「配信していないものは名乗らない」が働いた結果であり、欠陥ではない。作業が再開すれば戻る。\n\n## 裁定が要ること\n\n実態表示のまま（推奨）か、停止中も載せる機能を足すか。**オーナー裁定まで着手しない。**","lane":"decision","narrative_anchor":null,"narrative_ref":"docs/archive/plan_bridge-persistence-recovery_tasks.md#L12","parent_task_id":null,"task_id":"bpr7-kitepon-visibility","title":"停止中projectを公開一覧へ載せるかを裁定する"},{"compile_binding":null,"design_memo":"## 記録する罠\n\nSSH越しに起動したWindowsのprocessは、SSH sessionが閉じた瞬間に落ちる（wscript経由でも同じ）。\nsession中は`netstat`にLISTENINGが出るため、同一session内では生きて見え、次の接続では消えている。\nこの非対称が「経路が塞がっている」という誤診を生む。\n\nvisibility: private（このrepo/端末構成に固有）。","lane":"knowledge","narrative_anchor":null,"narrative_ref":"docs/archive/plan_bridge-persistence-recovery_tasks.md#L13","parent_task_id":null,"task_id":"bpr8-caveat","title":"SSH session連動でWindows常駐が落ちる罠を罠DBへ記録する"}],"topology_digest":"d38009e3c840560648657207919d3135f21e849029aa71ecb26799cd791aae8b"},"plan_key":"bridge-persistence-recovery","predecessor":{"journal_head_digest":"6c05fa5289396d26d04ec9383095a2df086c1086b24707ec34223c11c30488d8","plan_digest":"f4fcdab92987bdbda16f840330ef378ddd48a9c6a33be29b199d2156a135eb5c","plan_version":"rev-83d2c41d5f7cd5d57810bb0b"},"project_id":"lattice","reconciliation":{"predecessor_reconciliation_digest":"bd7bfdda87cc2d0fdcb6800dac334b3446807b8dcc80574262ac9b29d47164bb","reconciliation_digest":"8ee7aa939c86b21ad51131134fafb7428bf6854d2fcfc41c90a4d2b88fc72563","source_inventory_digest":"4d425ce07e86b6caf746020308ee5064e41def676d954f352bc4069b45b4a792"},"revision_digest":"471bb07a63c3f65fdd0b1db92042b1cf7ee6aa37f79fd062f23544b672e5b59d","schema":"lattice.todo_revision.v2","source_cutover_batch":{"archive_ref":"docs/archive/plan_bridge-persistence-recovery-bpr5-retirement.md","batch_digest":"a3f5809ee8a6128a949107eba6bf354dd0f2da89f5ccf21f3e6611265ccced73","batch_id":"bpr5-scope-retirement-20260811","operations":[{"disposition":"excluded","live_replacement":"- bpr5-fox-install: FOX固有の配備はdotagents所有のため、Lattice製品工程から退役","source_digest":"7b57a2e9953945e9857708ec5485cee446dfdc10c03a5b72fb04db0901bab483","source_ref":"docs/archive/plan_bridge-persistence-recovery_tasks.md#L10","task_id":null}]},"source_inventory":{"active":[{"source_digest":"ca4054fd614f0eb2c5021dcc5c4d86f210819db1a3f802f46571e922ca55f113","source_ref":"docs/archive/plan_bridge-persistence-recovery_tasks.md#L6","task_id":"bpr1-selfheal"},{"source_digest":"3ef95edee77c037cc00797855b24601b05d3f3ff7a2404e7065b99bde62a74c3","source_ref":"docs/archive/plan_bridge-persistence-recovery_tasks.md#L7","task_id":"bpr2-doc-split"},{"source_digest":"bd99fe0997d465e7a83742e0b46214237a00a50e7e1d3d3c8218f8678f9801c7","source_ref":"docs/archive/plan_bridge-persistence-recovery_tasks.md#L8","task_id":"bpr3-adr"},{"source_digest":"5901bc5bc66651938bebd925e25db73b85f5f65e127b55b96480486ed0032e2a","source_ref":"docs/archive/plan_bridge-persistence-recovery_tasks.md#L9","task_id":"bpr4-release"},{"source_digest":"f16f7f478b246afb84857818c4f0d87665901a1d248dc32c104d96a4f7c49e13","source_ref":"docs/archive/plan_bridge-persistence-recovery_tasks.md#L12","task_id":"bpr7-kitepon-visibility"},{"source_digest":"d2ec29e97b3c7dc27abd00f0106248d6535141e48da36afb0738d2e339cbd0cb","source_ref":"docs/archive/plan_bridge-persistence-recovery_tasks.md#L13","task_id":"bpr8-caveat"}],"excluded_tombstones":[{"exclusion_reason":"オーナー裁定2026-08-11。FOX固有のinstall・更新・Startup配線はdotagentsの工場展開が所有し、Lattice全ユーザー向け製品工程との二重化になるため退役","source_digest":"7b57a2e9953945e9857708ec5485cee446dfdc10c03a5b72fb04db0901bab483","source_ref":"docs/archive/plan_bridge-persistence-recovery-bpr5-retirement.md#L6"},{"exclusion_reason":"オーナー裁定2026-08-10により工程ごと打ち切り。未commit成果も廃棄済みで再開しない","source_digest":"b652f9309f3712c844d7b761c182f012f228045de6c74a5de2c4c0e13c0a67cc","source_ref":"docs/archive/plan_bridge-persistence-recovery_tasks.md#L11"}]},"task_migration":[{"from_task_id":"bpr1-selfheal","state_policy":"carry_reconciled_metadata","to_task_id":"bpr1-selfheal"},{"from_task_id":"bpr2-doc-split","state_policy":"carry_reconciled_metadata","to_task_id":"bpr2-doc-split"},{"from_task_id":"bpr3-adr","state_policy":"carry_reconciled_metadata","to_task_id":"bpr3-adr"},{"from_task_id":"bpr4-release","state_policy":"carry_reconciled_metadata","to_task_id":"bpr4-release"},{"from_task_id":"bpr5-fox-install","state_policy":"removed","to_task_id":"removed"},{"from_task_id":"bpr7-kitepon-visibility","state_policy":"carry_reconciled_metadata","to_task_id":"bpr7-kitepon-visibility"},{"from_task_id":"bpr8-caveat","state_policy":"carry_reconciled_metadata","to_task_id":"bpr8-caveat"}]}
